<?xml version="1.0" encoding="UTF-8"?>
<xs:schema xmlns:xs="http://www.w3.org/2001/XMLSchema">
  <xs:element name="glia_rules">
    <xs:complexType>
      <xs:sequence>
        <xs:element name="globals" minOccurs="0">
          <xs:complexType>
            <xs:sequence>
              <xs:element name="extensions" type="xs:string"/>
              <xs:element name="ignored_dirs" type="xs:string"/>
              <xs:element name="ui_strings" minOccurs="0">
                <xs:complexType>
                  <xs:sequence>
                    <xs:element name="string" maxOccurs="unbounded">
                      <xs:complexType>
                        <xs:attribute name="key" type="xs:string" use="required"/>
                        <xs:attribute name="value" type="xs:string" use="required"/>
                      </xs:complexType>
                    </xs:element>
                  </xs:sequence>
                </xs:complexType>
              </xs:element>
            </xs:sequence>
          </xs:complexType>
        </xs:element>
        <xs:element name="command" maxOccurs="unbounded">
          <xs:complexType>
            <xs:sequence>
              <xs:element name="param" minOccurs="0" maxOccurs="unbounded">
                <xs:complexType>
                  <xs:attribute name="key" type="xs:string" use="required"/>
                  <xs:attribute name="value" type="xs:string" use="required"/>
                </xs:complexType>
              </xs:element>
              <xs:element name="list" minOccurs="0" maxOccurs="unbounded">
                <xs:complexType>
                  <xs:sequence>
                    <xs:element name="item" type="xs:string" maxOccurs="unbounded"/>
                  </xs:sequence>
                  <xs:attribute name="name" type="xs:string" use="required"/>
                </xs:complexType>
              </xs:element>
            </xs:sequence>
            <xs:attribute name="name" type="xs:string" use="required"/>
            <xs:attribute name="description" type="xs:string" use="required"/>
            <xs:attribute name="type" type="xs:string" use="required"/>
            <xs:attribute name="target" type="xs:string" use="required"/>
          </xs:complexType>
        </xs:element>
      </xs:sequence>
    </xs:complexType>
  </xs:element>
</xs:schema>
